[
  {
    "hebrew_name": "פרמטר קושי A",
    "english_name": "Cauchy Parameter A",
    "hebrew_var": "פרמטר_קושי_A",
    "english_var": "cauchy_a",
    "symbol": "A",
    "value": 1.5969194656387147,
    "error": 0.0002670332322464817,
    "units": "",
    "formatted_value": "1.59692 pm 0.00027",
    "scale": 1.0,
    "fmt_spec": ".5f",
    "suffix": ""
  },
  {
    "hebrew_name": "פרמטר קושי B",
    "english_name": "Cauchy Parameter B",
    "hebrew_var": "פרמטר_קושי_B",
    "english_var": "cauchy_b",
    "symbol": "B",
    "value": 8394.908576838108,
    "error": 71.95763824676357,
    "units": "\"nm\"^2",
    "formatted_value": "8394.9 pm 72.0",
    "scale": 1.0,
    "fmt_spec": ".1f",
    "suffix": ""
  },
  {
    "hebrew_name": "קבוע רידברג (מנסרה)",
    "english_name": "Rydberg Constant (Prism)",
    "hebrew_var": "קבוע_רידברג_מנסרה",
    "english_var": "rydberg_prism",
    "symbol": "R_p",
    "value": 11120086.00869387,
    "error": 42689.06765286141,
    "units": "\"m\"^(-1)",
    "formatted_value": "(1.1120 pm 0.0043) times 10^(7)",
    "scale": 1.0,
    "fmt_spec": ".4e",
    "suffix": ""
  },
  {
    "hebrew_name": "קבוע רידברג (סריג)",
    "english_name": "Rydberg Constant (Grating)",
    "hebrew_var": "קבוע_רידברג_סריג",
    "english_var": "rydberg_grating",
    "symbol": "R_g",
    "value": 10911063.841724819,
    "error": 18900.760737630088,
    "units": "\"m\"^(-1)",
    "formatted_value": "(1.0911 pm 0.0019) times 10^(7)",
    "scale": 1.0,
    "fmt_spec": ".4e",
    "suffix": ""
  },
  {
    "hebrew_name": "מרחק סטטיסטי קבוע רידברג (מנסרה)",
    "english_name": "Rydberg Constant Sigma Distance (Prism)",
    "hebrew_var": "מרחק_רידברג_מנסרה",
    "english_var": "rydberg_prism_sigma",
    "symbol": "sigma_(R_p)",
    "value": 3.4283822206239023,
    "error": null,
    "units": "",
    "formatted_value": "3.43",
    "scale": 1.0,
    "fmt_spec": ".2f",
    "suffix": ""
  },
  {
    "hebrew_name": "מרחק סטטיסטי קבוע רידברג (סריג)",
    "english_name": "Rydberg Constant Sigma Distance (Grating)",
    "hebrew_var": "מרחק_רידברג_סריג",
    "english_var": "rydberg_grating_sigma",
    "symbol": "sigma_(R_g)",
    "value": 3.3156192643719113,
    "error": null,
    "units": "",
    "formatted_value": "3.32",
    "scale": 1.0,
    "fmt_spec": ".2f",
    "suffix": ""
  },
  {
    "hebrew_name": "מרחק סטטיסטי כספית",
    "english_name": "Mercury Green Line Sigma Distance",
    "hebrew_var": "מרחק_כספית",
    "english_var": "mercury_green_sigma",
    "symbol": "sigma_(H g)",
    "value": 0.015318897797671635,
    "error": null,
    "units": "",
    "formatted_value": "0.02",
    "scale": 1.0,
    "fmt_spec": ".2f",
    "suffix": ""
  }
]